"Input","Predict","Frequency"
"the only thing that","makes",8.99280575539568e-05
"the only thing worse","than",0.000107913669064748
"the only thing you","can",0.00012589928057554
"the only way i","can",8.99280575539568e-05
"the only way to","get",0.000215827338129496
"the opposite side of","the",8.99280575539568e-05
"the order of the","day",0.000107913669064748
"the other day i","was",0.000107913669064748
"the other end of","the",0.000341726618705036
"the other half of","the",0.000107913669064748
"the other members of","the",8.99280575539568e-05
"the other side of","the",0.000971223021582734
"the past couple of","days",0.000107913669064748
"the past couple of","weeks",0.000161870503597122
"the past few months","i",0.00012589928057554
"the past few years","i",0.00012589928057554
"the people in my","life",8.99280575539568e-05
"the point of view","of",0.000107913669064748
"the popular sports in","italy",0.000197841726618705
"the president of the","united",0.000107913669064748
"the pros and cons","of",8.99280575539568e-05
"the pungle.me app check","it",0.00012589928057554
"the race for the","cure",8.99280575539568e-05
"the rest of her","life",8.99280575539568e-05
"the rest of my","life",0.000593525179856115
"the rest of our","lives",8.99280575539568e-05
"the rest of the","country",0.000107913669064748
"the rest of the","crew",0.00012589928057554
"the rest of the","day",0.000809352517985611
"the rest of the","evening",0.00012589928057554
"the rest of the","family",0.000161870503597122
"the rest of the","game",0.000143884892086331
"the rest of the","ingredients",0.00012589928057554
"the rest of the","month",0.000143884892086331
"the rest of the","night",0.000377697841726619
"the rest of the","people",0.000107913669064748
"the rest of the","season",0.000161870503597122
"the rest of the","story",0.000161870503597122
"the rest of the","team",0.000107913669064748
"the rest of the","time",0.000143884892086331
"the rest of the","way",0.00012589928057554
"the rest of the","week",0.000485611510791367
"the rest of the","weekend",0.000107913669064748
"the rest of the","world",0.000845323741007194
"the rest of the","year",0.000233812949640288
"the rest of this","week",8.99280575539568e-05
"the rest of us","have",8.99280575539568e-05
"the rest of your","life",0.000251798561151079
"the right side of","the",0.000197841726618705
"the right thing to","do",0.000377697841726619
"the rise and fall","of",0.000107913669064748
"the road to success","is",0.000107913669064748
"the rock and roll","hall",0.000107913669064748
"the rt have a","great",8.99280575539568e-05
"the rt looking forward","to",8.99280575539568e-05
"the same is true","of",0.00012589928057554
"the same thing over","and",0.000107913669064748
"the same time as","the",0.000143884892086331
"the same time i","am",8.99280575539568e-05
"the same time it","is",8.99280575539568e-05
"the santelena hotel venice","italy",0.000161870503597122
"the school of law","loyola",0.000161870503597122
"the second half of","the",0.000215827338129496
"the second round of","the",0.000107913669064748
"the shit out of","me",0.00012589928057554
"the side of the","road",0.00039568345323741
"the sides of the","bowl",0.000107913669064748
"the stage at the","world",0.000107913669064748
"the start of the","season",0.00012589928057554
"the supreme flavor and","spirit",0.000107913669064748
"the surface of the","water",8.99280575539568e-05
"the thanks for the","follow",0.000161870503597122
"the time i got","to",8.99280575539568e-05
"the time of your","life",0.000197841726618705
"the time to do","it",8.99280575539568e-05
"the tip of the","iceberg",0.00012589928057554
"the title of this","post",0.00012589928057554
"the top of my","head",0.00012589928057554
"the top of my","list",0.00012589928057554
"the top of the","hill",0.000107913669064748
"the top of the","list",0.000107913669064748
"the truth and the","life",8.99280575539568e-05
"the truth of the","matter",8.99280575539568e-05
"the u.s house of","representatives",8.99280575539568e-05
"the united states of","america",0.000215827338129496
"the university of chicago","chicago",0.000197841726618705
"the upper part of","the",8.99280575539568e-05
"the very first time","i",8.99280575539568e-05
"the way back to","the",0.000107913669064748
"the way i see","it",0.000107913669064748
"the way in which","the",0.00012589928057554
"the way in which","we",8.99280575539568e-05
"the way it turned","out",0.000143884892086331
"the way the truth","and",8.99280575539568e-05
"the way to do","it",0.000161870503597122
"the wee hours of","the",8.99280575539568e-05
"the winner will be","announced",0.000107913669064748
"the word of god","and",0.000143884892086331
"the word of god","in",8.99280575539568e-05
"the word of god","is",8.99280575539568e-05
"the word of the","lord",8.99280575539568e-05
"the world a better","place",0.000143884892086331
"the world famous comic","strip",0.000161870503597122
"the world we live","in",0.000107913669064748
"the world would be","a",0.000143884892086331
"the wrong side of","the",8.99280575539568e-05
"them at the end","of",8.99280575539568e-05
"them at the same","time",8.99280575539568e-05
"them f0 u 009f","u",0.000143884892086331
"them thanks for the","follow",0.00012589928057554
"then all of a","sudden",0.000143884892086331
"then alls you got","to",8.99280575539568e-05
"then i went to","the",8.99280575539568e-05
"there's no such thing","as",8.99280575539568e-05
"there are a couple","of",0.000197841726618705
"there are a few","things",0.000107913669064748
"there are a lot","of",0.0012410071942446
"there are a number","of",0.000305755395683453
"there are a ton","of",8.99280575539568e-05
"there are different kinds","of",8.99280575539568e-05
"there are going to","be",0.000143884892086331
"there are only a","few",0.00012589928057554
"there are quite a","few",0.00012589928057554
"there are so many","great",0.000107913669064748
"there are so many","people",8.99280575539568e-05
"there are so many","things",0.000233812949640288
"there are still a","few",0.000107913669064748
"there are times when","i",0.000161870503597122
"there are two types","of",0.000107913669064748
"there comes a point","where",8.99280575539568e-05
"there has been a","lot",0.000143884892086331
"there has never been","a",8.99280575539568e-05
"there has to be","a",0.000233812949640288
"there have been a","few",0.000107913669064748
"there in the midst","of",0.000107913669064748
"there is a difference","between",0.000179856115107914
"there is a lot","of",0.000575539568345324
"there is a lot","to",0.000107913669064748
"there is a reason","for",8.99280575539568e-05
"there is a way","to",8.99280575539568e-05
"there is anything we","can",0.000107913669064748
"there is going to","be",0.00012589928057554
"there is more than","one",0.000107913669064748
"there is no doubt","that",0.000233812949640288
"there is no excuse","for",8.99280575539568e-05
"there is no need","for",8.99280575539568e-05
"there is no need","to",0.000215827338129496
"there is no such","thing",0.000323741007194245
"there is no way","i",0.00012589928057554
"there is no way","to",0.00012589928057554
"there is nothing better","than",0.000107913669064748
"there is nothing wrong","with",0.000233812949640288
"there is nothing you","can",8.99280575539568e-05
"there is one thing","i",8.99280575539568e-05
"there is so much","to",0.000215827338129496
"there is something to","be",8.99280575539568e-05
"there is such a","thing",0.000161870503597122
"there needs to be","a",0.000143884892086331
"there s a lot","of",0.000251798561151079
"there s going to","be",0.00012589928057554
"there s no need","to",0.000107913669064748
"there s nothing wrong","with",0.00012589928057554
"there seems to be","a",0.000215827338129496
"there was a lot","of",0.000233812949640288
"there was a time","when",0.000197841726618705
"there was a way","to",8.99280575539568e-05
"there was no way","i",0.000161870503597122
"there was no way","that",8.99280575539568e-05
"there were a couple","of",0.000107913669064748
"there were a lot","of",0.000341726618705036
"there were a number","of",0.000107913669064748
"there will be no","more",8.99280575539568e-05
"there will not be","a",8.99280575539568e-05
"there you have it","my",8.99280575539568e-05
"these are just a","few",0.000179856115107914
"these are some of","the",0.000107913669064748
"they are going to","be",0.000143884892086331
"they are not going","to",0.000107913669064748
"they are the ones","who",0.000107913669064748
"they don t have","to",8.99280575539568e-05
"they don t want","to",0.000287769784172662
"they sing happy birthday","to",0.000161870503597122
"they were going to","be",0.00012589928057554
"they were going to","do",8.99280575539568e-05
"they will be able","to",0.000143884892086331
"thing i want to","do",8.99280575539568e-05
"thing over and over","again",0.000107913669064748
"thing to do is","to",0.00012589928057554
"thing you can do","is",0.000107913669064748
"things are back to","normal",8.99280575539568e-05
"things come to those","who",0.000179856115107914
"things happen for a","reason",0.00012589928057554
"things that need to","be",8.99280575539568e-05
"think a lot of","people",8.99280575539568e-05
"think i'm in love","with",8.99280575539568e-05
"think i am going","to",0.000143884892086331
"think it's safe to","say",0.000143884892086331
"think it would be","a",0.000107913669064748
"think of it as","a",0.000215827338129496
"this account to support","you",8.99280575539568e-05
"this boy saying he","can",8.99280575539568e-05
"this content is provided","as",0.00039568345323741
"this does not mean","that",8.99280575539568e-05
"this f0 u 009f","u",0.000107913669064748
"this has been one","of",0.000107913669064748
"this has nothing to","do",0.000143884892086331
"this has to do","with",8.99280575539568e-05
"this have to do","with",0.000161870503597122
"this holiday season you","can",0.00012589928057554
"this is a bit","of",8.99280575539568e-05
"this is a good","thing",0.000161870503597122
"this is a story","of",0.000107913669064748
"this is an example","of",8.99280575539568e-05
"this is crazy but","heres",0.000107913669064748
"this is going to","be",0.000845323741007194
"this is gonna be","a",0.000179856115107914
"this is not a","good",0.00012589928057554
"this is not to","say",8.99280575539568e-05
"this is one of","my",0.000233812949640288
"this is one of","the",0.000665467625899281
"this is one of","those",0.000377697841726619
"this is part of","the",8.99280575539568e-05
"this is the first","time",0.000611510791366906
"this is the kind","of",0.000143884892086331
"this is the last","time",8.99280575539568e-05
"this is what happens","when",8.99280575539568e-05
"this is what i","do",0.000107913669064748
"this is why i","am",0.000107913669064748
"this morning i woke","up",8.99280575539568e-05
"this time last year","i",0.00012589928057554
"this time of the","year",8.99280575539568e-05
"this was going to","be",0.00012589928057554
"this was my first","time",0.00012589928057554
"this was one of","the",0.000143884892086331
"this was the first","time",0.000107913669064748
"this website comes from","amazon",0.00039568345323741
"this will be my","last",8.99280575539568e-05
"this would be a","good",8.99280575539568e-05
"those of us who","are",0.00012589928057554
"those of us who","have",8.99280575539568e-05
"those of you who","are",0.000305755395683453
"those of you who","don",8.99280575539568e-05
"those of you who","don't",8.99280575539568e-05
"those of you who","have",0.00012589928057554
"those of you who","know",0.000161870503597122
"those who believe in","the",0.000107913669064748
"though f0 u 009f","u",0.000143884892086331
"thought i'd see the","day",0.000107913669064748
"thought i was going","to",0.000179856115107914
"thought i was the","only",0.000107913669064748
"thought it'd be fun","to",8.99280575539568e-05
"thought it might be","a",8.99280575539568e-05
"thought it was going","to",0.000161870503597122
"thought it would be","a",0.000233812949640288
"thought it would be","fun",0.000305755395683453
"thought you might like","to",8.99280575539568e-05
"thoughts and prayers are","with",0.000215827338129496
"thoughts and prayers go","out",0.000107913669064748
"through the eyes of","a",0.000107913669064748
"through the rest of","the",0.000107913669064748
"time f0 u 009f","u",0.000197841726618705
"time for me to","go",0.000107913669064748
"time in a long","time",0.000161870503597122
"time in my life","i",0.00012589928057554
"time of with nike","gps",0.00026978417266187
"time to get back","to",0.000179856115107914
"time to get ready","for",0.000179856115107914
"time to get rid","of",8.99280575539568e-05
"time to go back","to",0.00012589928057554
"time to go to","the",8.99280575539568e-05
"time to hit the","gym",8.99280575539568e-05
"time with family and","friends",0.000107913669064748
"tip of the day","if",0.000107913669064748
"to a whole new","level",0.00012589928057554
"to accept the fact","that",8.99280575539568e-05
"to all my new","followers",0.000305755395683453
"to all of you","for",8.99280575539568e-05
"to all of you","who",0.000179856115107914
"to all our new","followers",0.000107913669064748
"to all the moms","out",0.000107913669064748
"to all the new","followers",0.000107913669064748
"to all the people","who",0.000107913669064748
"to all who came","out",0.000323741007194245
"to amazon.com amazon.ca amazon.co.uk","amazon.de",0.00039568345323741
"to be a bit","of",0.000143884892086331
"to be a good","day",0.000287769784172662
"to be a great","day",0.000233812949640288
"to be a little","more",0.000107913669064748
"to be a lot","more",0.000107913669064748
"to be a lot","of",0.000215827338129496
"to be a part","of",0.00120503597122302
"to be able to","do",0.000107913669064748
"to be able to","get",0.000197841726618705
"to be able to","go",0.000179856115107914
"to be able to","make",0.000179856115107914
"to be able to","see",0.000179856115107914
"to be able to","spend",8.99280575539568e-05
"to be able to","take",0.000107913669064748
"to be entered to","win",8.99280575539568e-05
"to be found in","the",0.000107913669064748
"to be in the","same",0.000143884892086331
"to be included in","the",8.99280575539568e-05
"to be known as","the",8.99280575539568e-05
"to be one of","my",0.000107913669064748
"to be one of","the",0.000431654676258993
"to be one of","them",8.99280575539568e-05
"to be one of","those",0.000179856115107914
"to be part of","a",0.00012589928057554
"to be part of","the",0.000287769784172662
"to be part of","this",0.000107913669064748
"to be some sort","of",8.99280575539568e-05
"to be the death","of",8.99280575539568e-05
"to be the one","to",8.99280575539568e-05
"to become a part","of",8.99280575539568e-05
"to call it a","night",0.000107913669064748
"to change or removal","at",0.00039568345323741
"to check it out","thanks",8.99280575539568e-05
"to come to terms","with",0.00012589928057554
"to come up with","a",0.000413669064748201
"to come up with","some",0.000161870503597122
"to come up with","something",0.00012589928057554
"to do a lot","of",8.99280575539568e-05
"to do anything about","it",0.000107913669064748
"to do in order","to",0.000107913669064748
"to do my best","to",0.000107913669064748
"to do so little","time",8.99280575539568e-05
"to do the right","thing",0.000107913669064748
"to do what to","do",0.000107913669064748
"to do with it","but",8.99280575539568e-05
"to do with my","life",0.00012589928057554
"to do with the","fact",0.000143884892086331
"to earn advertising fees","by",0.00039568345323741
"to everyone that came","out",0.000161870503597122
"to everyone who came","out",0.000431654676258993
"to everyone who came","to",0.000197841726618705
"to f0 u 009f","u",0.00012589928057554
"to failure is trying","to",0.000107913669064748
"to fall in love","with",8.99280575539568e-05
"to figure out how","to",0.000557553956834532
"to figure out what","to",0.000161870503597122
"to find a way","to",0.000557553956834532
"to find out more","about",0.000107913669064748
"to find out what","happens",8.99280575539568e-05
"to find something to","do",8.99280575539568e-05
"to find the time","to",0.000107913669064748
"to follow me on","google",0.000197841726618705
"to get a hold","of",8.99280575539568e-05
"to get a lot","of",0.000143884892086331
"to get away from","the",0.000143884892086331
"to get back into","the",0.000251798561151079
"to get back on","the",0.000179856115107914
"to get back on","track",0.000107913669064748
"to get back to","my",0.000161870503597122
"to get back to","the",0.00026978417266187
"to get back to","work",0.000179856115107914
"to get back to","you",8.99280575539568e-05
"to get in for","free",0.000143884892086331
"to get in touch","with",0.000143884892086331
"to get my hands","on",8.99280575539568e-05
"to get out of","a",8.99280575539568e-05
"to get out of","bed",0.000287769784172662
"to get out of","here",8.99280575539568e-05
"to get out of","my",0.000179856115107914
"to get out of","the",0.000359712230215827
"to get out of","this",0.000251798561151079
"to get out there","and",0.000107913669064748
"to get ready for","the",8.99280575539568e-05
"to get rid of","that",8.99280575539568e-05
"to get rid of","the",0.000251798561151079
"to get some work","done",8.99280575539568e-05
"to get the hang","of",8.99280575539568e-05
"to get the hell","out",8.99280575539568e-05
"to get the job","done",0.00012589928057554
"to get the word","out",0.00012589928057554
"to get to follow","me",0.000143884892086331
"to get to know","you",8.99280575539568e-05
"to get you to","follow",0.00012589928057554
"to getting to know","you",0.000161870503597122
"to give it a","go",0.000107913669064748
"to give it a","little",0.000107913669064748
"to give it a","try",0.000359712230215827
"to give you an","idea",0.000107913669064748
"to go along with","the",0.00012589928057554
"to go back in","time",0.000107913669064748
"to go back to","school",0.000197841726618705
"to go back to","sleep",0.000143884892086331
"to go back to","the",0.000215827338129496
"to go for a","walk",0.00012589928057554
"to go out there","and",0.000107913669064748
"to go straight to","the",8.99280575539568e-05
"to go to the","bathroom",0.000143884892086331
"to go to the","beach",0.000107913669064748
"to go to the","gym",0.00012589928057554
"to go to the","hospital",0.000161870503597122
"to go to the","movies",0.000143884892086331
"to happiness happiness is","the",0.000107913669064748
"to have a conversation","with",8.99280575539568e-05
"to have a good","time",0.000107913669064748
"to have a lot","of",0.000161870503597122
"to have been a","part",8.99280575539568e-05
"to have so much","fun",8.99280575539568e-05
"to have the opportunity","to",8.99280575539568e-05
"to have to go","to",0.000107913669064748
"to have you as","a",0.000107913669064748
"to have you join","us",8.99280575539568e-05
"to have you on","board",8.99280575539568e-05
"to have you with","us",8.99280575539568e-05
"to help you with","your",8.99280575539568e-05
"to her please what","kind",0.000143884892086331
"to keep an eye","on",0.00012589928057554
"to keep and bear","arms",8.99280575539568e-05
"to keep track of","the",8.99280575539568e-05
"to keep up with","the",0.000215827338129496
"to kimberly and sasha","can",0.000161870503597122
"to know what was","going",0.000107913669064748
"to know you better","who",0.000107913669064748
"to learn more about","the",0.00012589928057554
"to let go of","the",8.99280575539568e-05
"to let me know","that",0.00012589928057554
"to let you know","that",0.000251798561151079
"to like us on","facebook",0.000107913669064748
"to live in a","world",8.99280575539568e-05
"to live life to","the",0.000107913669064748
"to look forward to","in",8.99280575539568e-05
"to make a difference","in",0.000161870503597122
"to make it to","the",0.000287769784172662
"to make room for","the",0.000107913669064748
"to make sure that","i",0.000107913669064748
"to make sure that","the",8.99280575539568e-05
"to make the best","of",0.000107913669064748
"to make the most","of",0.00026978417266187
"to make up for","it",0.000143884892086331
"to make up for","the",0.000161870503597122
"to me all the","time",0.000143884892086331
"to me f0 u","009f",0.00012589928057554
"to me i love","you",8.99280575539568e-05
"to me to be","the",8.99280575539568e-05
"to meet the needs","of",8.99280575539568e-05
"to meet you in","person",8.99280575539568e-05
"to meet you last","night",0.000107913669064748
"to one of my","favorite",0.000161870503597122
"to one of the","most",8.99280575539568e-05
"to pick up a","few",8.99280575539568e-05
"to provide a means","for",0.00039568345323741
"to say i love","you",0.000179856115107914
"to say i was","a",8.99280575539568e-05
"to say that i","am",0.000179856115107914
"to say that i","love",8.99280575539568e-05
"to see if i","can",0.000161870503597122
"to see if i","could",0.000197841726618705
"to see if it","was",8.99280575539568e-05
"to see if there","is",0.000107913669064748
"to see if there","was",0.000107913669064748
"to see if they","had",0.000107913669064748
"to see some of","my",8.99280575539568e-05
"to see some of","the",8.99280575539568e-05
"to see the hunger","games",0.000161870503597122
"to see what all","the",0.000107913669064748
"to see what i","can",8.99280575539568e-05
"to see what kind","of",0.000107913669064748
"to see what you","create",8.99280575539568e-05
"to see you again","soon",0.000143884892086331
"to see you all","there",8.99280575539568e-05
"to see you as","well",0.00012589928057554
"to see you at","the",0.000197841726618705
"to see you on","the",0.000179856115107914
"to see you on","twitter",0.000197841726618705
"to seeing you at","the",0.00012589928057554
"to share how kanjoya's","emotional",8.99280575539568e-05
"to share it with","you",0.000161870503597122
"to share them with","you",0.000107913669064748
"to share with you","all",0.00012589928057554
"to share with you","my",0.000107913669064748
"to share with you","today",0.000179856115107914
"to sign up for","the",0.00012589928057554
"to spend a lot","of",0.000107913669064748
"to spend more time","with",0.000197841726618705
"to spend some time","with",0.000161870503597122
"to spend the rest","of",0.000107913669064748
"to spend time with","my",8.99280575539568e-05
"to start the new","year",0.000107913669064748
"to stay in touch","with",8.99280575539568e-05
"to stay out of","the",0.000107913669064748
"to step out of","the",0.000107913669064748
"to succeed your desire","for",8.99280575539568e-05
"to success but the","key",0.000107913669064748
"to support you please","follow",8.99280575539568e-05
"to take a break","from",8.99280575539568e-05
"to take a look","at",0.00026978417266187
"to take a moment","to",0.000143884892086331
"to take a picture","of",0.000287769784172662
"to take advantage of","the",0.000161870503597122
"to take care of","it",8.99280575539568e-05
"to take care of","the",0.000179856115107914
"to take on the","day",8.99280575539568e-05
"to take over the","world",0.000107913669064748
"to take the time","to",0.000143884892086331
"to talk to me","about",0.00012589928057554
"to talk to you","about",0.000215827338129496
"to taste with salt","and",8.99280575539568e-05
"to teach me how","to",8.99280575539568e-05
"to tell you about","the",0.00012589928057554
"to tell you that","i",0.00012589928057554
"to tell you the","truth",0.000107913669064748
"to thank all of","you",0.00012589928057554
"to thank you all","for",8.99280575539568e-05
"to the back of","the",0.000179856115107914
"to the best of","my",8.99280575539568e-05
"to the bottom of","the",0.000287769784172662
"to the edge of","the",0.00012589928057554
"to the end of","the",0.000251798561151079
"to the fact that","i",0.000107913669064748
"to the fact that","the",8.99280575539568e-05
"to the front of","the",0.000305755395683453
"to the kids who","are",8.99280575539568e-05
"to the left of","the",0.000179856115107914
"to the other side","of",0.000197841726618705
"to the point that","i",8.99280575539568e-05
"to the point where","he",8.99280575539568e-05
"to the point where","i",0.000287769784172662
"to the rest of","the",0.000413669064748201
"to the right of","the",8.99280575539568e-05
"to the side of","the",0.00012589928057554
"to the stage at","the",0.000107913669064748
"to the top of","my",8.99280575539568e-05
"to the top of","the",0.000359712230215827
"to the word of","god",8.99280575539568e-05
"to think of it","as",0.000161870503597122
"to those of us","who",8.99280575539568e-05
"to those of you","who",0.000161870503597122
"to those who believe","in",0.000107913669064748
"to top it all","off",0.000107913669064748
"to wake up in","the",0.000107913669064748
"to walk away from","the",8.99280575539568e-05
"to washington dc for","a",0.000107913669064748
"to you and your","family",0.000215827338129496
"to your house before","the",8.99280575539568e-05
"today's specials at emerald","city",8.99280575539568e-05
"today austin f0 u","009f",0.00012589928057554
"today f0 u 009f","u",0.000305755395683453
"today in literary history","on",8.99280575539568e-05
"today is a good","day",0.000197841726618705
"today is going to","be",0.000197841726618705
"today is the last","day",0.000197841726618705
"today was a good","day",0.000161870503597122
"today was one of","those",8.99280575539568e-05
"today was the first","day",0.00012589928057554
"told me that he","had",8.99280575539568e-05
"tomorrow f0 u 009f","u",0.000215827338129496
"tonight f0 u 009f","u",0.000215827338129496
"tonight is going to","be",0.000107913669064748
"too f0 u 009f","u",0.00012589928057554
"too good to be","true",0.000143884892086331
"too much for me","to",8.99280575539568e-05
"took me a long","time",0.000107913669064748
"took me a while","to",0.00012589928057554
"took me so long","to",8.99280575539568e-05
"towards the end of","the",0.000287769784172662
"trainer max the body","at",0.00012589928057554
"try adding a seattle","tour",0.00012589928057554
"trying to catch up","on",0.00012589928057554
"trying to come up","with",8.99280575539568e-05
