"Input","Predict","Frequency"
"enough to be able","to",8.99280575539568e-05
"entertained by what you","read",0.000107913669064748
"especially when it comes","to",0.000143884892086331
"eu associates programmes designed","to",0.00039568345323741
"eu this content is","provided",0.00039568345323741
"even after all these","years",8.99280575539568e-05
"even get me started","on",0.000107913669064748
"even if you are","not",0.000107913669064748
"even if you don","t",0.000197841726618705
"even know where to","begin",8.99280575539568e-05
"even know where to","start",8.99280575539568e-05
"ever f0 u 009f","u",0.000179856115107914
"ever get a chance","to",8.99280575539568e-05
"ever seen in my","life",0.000161870503597122
"every now and then","i",0.000107913669064748
"every once in a","while",0.000431654676258993
"every step of the","way",8.99280575539568e-05
"every time i go","to",0.000107913669064748
"every time i watch","it",8.99280575539568e-05
"everyone had a great","weekend",8.99280575539568e-05
"everyone has a great","day",8.99280575539568e-05
"everyone has a great","weekend",0.000107913669064748
"everyone is having a","good",0.000107913669064748
"everyone is having a","great",0.000197841726618705
"everyone that came out","to",8.99280575539568e-05
"everyone who came out","to",0.000251798561151079
"everything f0 u 009f","u",8.99280575539568e-05
"everything happens for a","reason",0.00012589928057554
"everything is going to","be",0.00012589928057554
"everything you need to","know",8.99280575539568e-05
"except for the fact","that",0.00012589928057554
"excited to be a","part",0.000143884892086331
"excited to be part","of",8.99280575539568e-05
"excited to be working","with",0.00012589928057554
"f u 03ad u","03c1",0.00012589928057554
"f0 u 009f u","008c",0.000503597122302158
"f0 u 009f u","008d",0.00100719424460432
"f0 u 009f u","008e",0.0022841726618705
"f0 u 009f u","008f",0.000539568345323741
"f0 u 009f u","009a",0.00039568345323741
"f0 u 009f u","u",0.0387769784172662
"failed i've just found","ways",8.99280575539568e-05
"failure is trying to","please",0.000107913669064748
"fairmont hotel in kansas","city",0.000143884892086331
"fall in love with","the",0.000107913669064748
"family law tip of","the",0.000197841726618705
"famous comic strip live","nyc",0.00012589928057554
"fan in chile follow","me",0.000107913669064748
"far as i can","tell",0.000161870503597122
"far as to say","that",0.000107913669064748
"fear of failure bill","cosby",8.99280575539568e-05
"feel because those who","mind",8.99280575539568e-05
"feel free to contact","me",8.99280575539568e-05
"feel free to share","your",8.99280575539568e-05
"feel like i'm going","to",8.99280575539568e-05
"feel like i have","a",8.99280575539568e-05
"feel like i need","a",0.000107913669064748
"feel like i should","be",8.99280575539568e-05
"feeling you get when","you",0.000161870503597122
"feels good to be","back",0.000107913669064748
"feels so good to","be",8.99280575539568e-05
"fees by advertising and","linking",0.00039568345323741
"fell in love with","the",0.000179856115107914
"felt like i was","in",0.000107913669064748
"figure out a way","to",0.000143884892086331
"figure out how to","get",0.000161870503597122
"figure out what to","do",0.000215827338129496
"fill in the blank","my",8.99280575539568e-05
"find a way to","get",0.00012589928057554
"find a way to","make",0.000179856115107914
"finished a mi run","with",0.000431654676258993
"first let me say","that",8.99280575539568e-05
"first thing i did","was",8.99280575539568e-05
"first thing in the","morning",0.00026978417266187
"first time in a","long",0.000179856115107914
"first time in my","life",0.000179856115107914
"flavor and spirit of","egalitarian",0.000107913669064748
"follow and let her","know",0.00012589928057554
"follow hope you're entertained","by",0.000107913669064748
"follow i look forward","to",0.000179856115107914
"follow me and i","will",0.000143884892086331
"follow me f0 u","009f",0.000107913669064748
"follow me follow me","follow",0.00012589928057554
"follow me i follow","back",0.000197841726618705
"follow me i love","you",0.000323741007194245
"follow me i would","do",0.000161870503597122
"follow me im a","big",8.99280575539568e-05
"follow me it would","mean",0.000197841726618705
"follow me please i","love",0.00012589928057554
"follow me pleasee oh","please",0.000107913669064748
"follow me so i","can",0.000323741007194245
"follow she is you","biggest",0.000161870503597122
"following better wine guide","now",0.000107913669064748
"following me looking forward","to",8.99280575539568e-05
"following me on twitter","don't",0.000197841726618705
"following poised creation on","twitter",0.000107913669064748
"following the hilltop on","twitter",8.99280575539568e-05
"food fact of the","day",8.99280575539568e-05
"for a chance to","win",0.000647482014388489
"for a concert and","meet-n-greet",0.000107913669064748
"for a couple of","days",0.000341726618705036
"for a couple of","hours",0.000161870503597122
"for a couple of","minutes",0.00012589928057554
"for a couple of","months",0.000107913669064748
"for a couple of","weeks",0.000161870503597122
"for a couple of","years",0.00012589928057554
"for a day or","two",8.99280575539568e-05
"for a few days","and",0.000143884892086331
"for a few days","i",8.99280575539568e-05
"for a few minutes","and",0.00012589928057554
"for a few years","and",8.99280575539568e-05
"for a long long","time",8.99280575539568e-05
"for a long time","and",0.000305755395683453
"for a long time","but",0.00012589928057554
"for a long time","i",0.000233812949640288
"for a long time","now",8.99280575539568e-05
"for a lot of","people",0.000107913669064748
"for a number of","reasons",0.000107913669064748
"for a number of","years",0.000107913669064748
"for a shorty award","in",8.99280575539568e-05
"for a variety of","reasons",0.000179856115107914
"for a very long","time",0.000305755395683453
"for a while now","but",8.99280575539568e-05
"for a year and","a",8.99280575539568e-05
"for about minutes or","until",0.000233812949640288
"for all the love","and",8.99280575539568e-05
"for all your hard","work",0.000107913669064748
"for an hour or","two",8.99280575539568e-05
"for as long as","i",0.000179856115107914
"for as long as","you",0.000107913669064748
"for coming out last","night",0.000107913669064748
"for coming out to","the",8.99280575539568e-05
"for following better wine","guide",0.000143884892086331
"for following looking forward","to",0.000107913669064748
"for following me looking","forward",8.99280575539568e-05
"for following me on","twitter",0.000341726618705036
"for following robin lynch","aerialist",8.99280575539568e-05
"for following the hilltop","on",8.99280575539568e-05
"for following us on","twitter",0.00012589928057554
"for free txt me","i",0.000143884892086331
"for helping to spread","the",0.000107913669064748
"for helping us spread","the",8.99280575539568e-05
"for including me in","your",8.99280575539568e-05
"for including us in","your",0.000107913669064748
"for lack of a","better",0.000107913669064748
"for me it was","a",8.99280575539568e-05
"for me thanks for","the",8.99280575539568e-05
"for me to go","to",8.99280575539568e-05
"for more than a","few",8.99280575539568e-05
"for most of my","life",0.000107913669064748
"for most of the","day",0.00012589928057554
"for no other reason","than",0.000107913669064748
"for no reason at","all",8.99280575539568e-05
"for one reason or","another",0.000107913669064748
"for quite some time","now",8.99280575539568e-05
"for school to be","over",8.99280575539568e-05
"for sites to earn","advertising",0.00039568345323741
"for spreading the word","about",0.00012589928057554
"for success should be","greater",8.99280575539568e-05
"for taking the time","to",0.000305755395683453
"for the best of","the",8.99280575539568e-05
"for the better part","of",0.00012589928057554
"for the both of","us",8.99280575539568e-05
"for the duration of","the",0.000107913669064748
"for the end of","the",0.000107913669064748
"for the faint of","heart",8.99280575539568e-05
"for the first day","of",0.000107913669064748
"for the first time","and",0.000179856115107914
"for the first time","ever",0.00026978417266187
"for the first time","i",0.00039568345323741
"for the first time","in",0.00156474820143885
"for the first time","it",0.000107913669064748
"for the first time","on",0.000161870503597122
"for the first time","since",0.000539568345323741
"for the first time","that",0.000107913669064748
"for the first time","the",0.000143884892086331
"for the first time","this",0.000215827338129496
"for the first time","today",0.000251798561151079
"for the first time","with",0.000107913669064748
"for the follow dm","me",8.99280575539568e-05
"for the follow following","you",8.99280575539568e-05
"for the follow have","a",0.00012589928057554
"for the follow hope","you",8.99280575539568e-05
"for the follow hope","you're",0.00012589928057554
"for the follow how","are",8.99280575539568e-05
"for the follow i","am",0.000107913669064748
"for the follow i","hope",8.99280575539568e-05
"for the follow i","look",0.000179856115107914
"for the follow i","love",0.000107913669064748
"for the follow look","forward",0.000107913669064748
"for the follow looking","forward",0.000215827338129496
"for the follow love","your",0.000143884892086331
"for the glory of","god",8.99280575539568e-05
"for the last few","days",0.000143884892086331
"for the life of","me",0.000215827338129496
"for the love and","support",0.000107913669064748
"for the love of","god",0.000161870503597122
"for the most part","but",8.99280575539568e-05
"for the most part","i",0.00026978417266187
"for the most part","it",8.99280575539568e-05
"for the most part","the",0.00012589928057554
"for the next two","weeks",0.00012589928057554
"for the opportunity to","be",8.99280575539568e-05
"for the past few","days",8.99280575539568e-05
"for the past few","months",0.000107913669064748
"for the past few","years",0.000107913669064748
"for the past year","and",0.000107913669064748
"for the price of","one",0.00012589928057554
"for the rest of","his",0.000107913669064748
"for the rest of","my",0.000485611510791367
"for the rest of","our",8.99280575539568e-05
"for the rest of","the",0.00151079136690647
"for the rest of","this",0.000107913669064748
"for the rest of","us",0.000215827338129496
"for the rest of","your",0.000161870503597122
"for the rt and","the",0.00012589928057554
"for the rt have","a",8.99280575539568e-05
"for the rt hope","you",0.000179856115107914
"for the rt looking","forward",8.99280575539568e-05
"for the rt on","the",8.99280575539568e-05
"for the rt see","you",0.000107913669064748
"for the sake of","the",0.000107913669064748
"for the second half","of",8.99280575539568e-05
"for the second time","in",0.00012589928057554
"for the shout out","we",0.000143884892086331
"for the very first","time",0.000161870503597122
"for those of us","who",0.000215827338129496
"for those of you","that",0.000179856115107914
"for those of you","who",0.000971223021582734
"for those who don","t",8.99280575539568e-05
"for to minutes or","until",0.000107913669064748
"for waking me up","this",8.99280575539568e-05
"for you and your","family",8.99280575539568e-05
"for your chance to","win",0.000179856115107914
"for your next event","send",8.99280575539568e-05
"force to be reckoned","with",8.99280575539568e-05
"forget to follow me","on",0.000197841726618705
"forgive myself that i","have",0.000161870503597122
"forgot to take a","picture",8.99280575539568e-05
"form of capitalism with","the",0.000107913669064748
"forward to getting to","know",0.000215827338129496
"forward to hearing from","you",0.000161870503597122
"forward to reading your","tweets",8.99280575539568e-05
"forward to seeing you","at",0.000197841726618705
"forward to seeing you","in",8.99280575539568e-05
"forward to tweeting with","you",0.00012589928057554
"forward to working with","you",0.000107913669064748
"foul foul foul foul","foul",0.000197841726618705
"found ways that won't","work",8.99280575539568e-05
"freaking out keep freaking","out",0.000161870503597122
"free and open to","the",8.99280575539568e-05
"free e-book award winning","novel",0.000107913669064748
"free txt me i","will",0.000143884892086331
"friday club drama want","to",0.000143884892086331
"from all of us","at",0.00012589928057554
"from all over the","world",0.000251798561151079
"from all walks of","life",8.99280575539568e-05
"from amazon services llc","and",0.00039568345323741
"from point a to","point",8.99280575539568e-05
"from the back of","the",0.000161870503597122
"from the beginning of","the",0.000107913669064748
"from the bottom of","my",0.000215827338129496
"from the end of","the",0.00012589928057554
"from the front of","the",8.99280575539568e-05
"from the new york","times",8.99280575539568e-05
"from the point of","view",0.000107913669064748
"from the rest of","the",8.99280575539568e-05
"from the top of","the",0.000161870503597122
"from time to time","and",0.00012589928057554
"from time to time","i",0.000107913669064748
"from time to time","the",8.99280575539568e-05
"from what i can","tell",0.00012589928057554
"fuck you all fuck","you",0.000161870503597122
"full of shit one","more",8.99280575539568e-05
"future belongs to those","who",0.000143884892086331
"g1 certified wet tshirt","contest",0.000143884892086331
"get a chance to","do",8.99280575539568e-05
"get a kick out","of",0.00012589928057554
"get back into the","swing",0.000143884892086331
"get back to you","on",0.000107913669064748
"get caught up in","the",0.00012589928057554
"get in for free","txt",0.000143884892086331
"get in the way","of",0.000251798561151079
"get in touch with","you",8.99280575539568e-05
"get it out of","the",8.99280575539568e-05
"get me started on","the",8.99280575539568e-05
"get me wrong i","love",0.00012589928057554
"get much better than","this",8.99280575539568e-05
"get out of the","way",8.99280575539568e-05
"get punked and he","did",8.99280575539568e-05
"get real rewards just","for",0.000413669064748201
"get the deal shown","here",8.99280575539568e-05
"get the hang of","it",0.000143884892086331
"get the hell out","of",0.000143884892086331
"get to know each","other",0.00012589928057554
"get to the point","where",0.000107913669064748
"get up in the","morning",0.000107913669064748
"get you to follow","me",0.000161870503597122
"gets to your house","before",8.99280575539568e-05
"getting ready to go","to",0.000161870503597122
"getting to know you","better",0.00012589928057554
"girl f0 u 009f","u",8.99280575539568e-05
"girl with the dragon","tattoo",0.000197841726618705
"girls f0 u 009f","u",0.000107913669064748
"give a shout out","to",0.000197841726618705
"give it a try","i",0.000143884892086331
"give me a chance","to",0.000107913669064748
"give me a shout","out",0.000215827338129496
"give you an idea","of",0.000107913669064748
"glad i'm not the","only",0.00012589928057554
"glad i could make","you",8.99280575539568e-05
"glad i got to","see",8.99280575539568e-05
"glad to be a","part",8.99280575539568e-05
"glad to hear it","thanks",8.99280575539568e-05
"glad you had a","good",0.00012589928057554
"glad you like it","i",8.99280575539568e-05
"go big or go","home",0.000107913669064748
"go out in the","midday",0.000107913669064748
"go out there and","do",8.99280575539568e-05
"go so far as","to",0.000161870503597122
"go to the same","school",8.99280575539568e-05
"goal in life is","to",8.99280575539568e-05
"god bless you and","your",8.99280575539568e-05
"god is watching us","the",8.99280575539568e-05
"god oh my god","oh",0.000143884892086331
"goes on to say","that",8.99280575539568e-05
"going on in my","life",0.000179856115107914
"going on in the","world",0.000107913669064748
"going to be a","beautiful",0.000107913669064748
"going to be a","busy",0.000161870503597122
"going to be a","good",0.000611510791366906
"going to be a","great",0.000737410071942446
"going to be a","long",0.000287769784172662
"going to be a","lot",0.000107913669064748
"going to be a","very",8.99280575539568e-05
"going to be able","to",0.000287769784172662
"going to be hard","to",0.000107913669064748
"going to be in","the",8.99280575539568e-05
"going to be on","the",0.000161870503597122
"going to be one","of",0.000179856115107914
"going to be the","best",0.000179856115107914
"going to be the","most",8.99280575539568e-05
"going to do with","it",0.000143884892086331
"going to give you","a",0.000107913669064748
"going to go to","the",8.99280575539568e-05
"going to have to","be",0.000251798561151079
"going to have to","do",0.000143884892086331
"going to have to","get",0.000107913669064748
"going to have to","go",0.000143884892086331
"going to make it","to",0.000107913669064748
"going to see the","avengers",8.99280575539568e-05
"going to take a","while",8.99280575539568e-05
"going to try to","get",0.000107913669064748
"going to use it","for",8.99280575539568e-05
"gonna be a good","day",0.000179856115107914
"good but i can","fuck",8.99280575539568e-05
"good f0 u 009f","u",0.000161870503597122
"good luck to all","the",0.000143884892086331
"good morning have a","great",0.00012589928057554
"good morning how are","you",0.00012589928057554
"good morning to you","too",0.000107913669064748
"good news is that","i",8.99280575539568e-05
"good thanks for the","follow",0.000107913669064748
"good things come to","those",0.000161870503597122
"good to hear from","you",0.000161870503597122
"got a kick out","of",8.99280575539568e-05
"got out of the","car",8.99280575539568e-05
"got the best of","me",0.000179856115107914
"got to be kidding","me",8.99280575539568e-05
"got to the point","where",8.99280575539568e-05
"gray rainbow journey limited","time",8.99280575539568e-05
"great day to be","a",8.99280575539568e-05
"great f0 u 009f","u",8.99280575539568e-05
"great seeing you last","night",0.000107913669064748
"great to be back","in",8.99280575539568e-05
"great to meet you","too",0.000161870503597122
"great to see so","many",0.000107913669064748
"great to see you","on",0.000143884892086331
"great to see you","today",8.99280575539568e-05
"great to see you","too",8.99280575539568e-05
"great way to end","the",0.000107913669064748
"great way to start","the",0.000233812949640288
"greater than your fear","of",8.99280575539568e-05
"greener on the other","side",8.99280575539568e-05
"guess is as good","as",8.99280575539568e-05
"guide now following you","too",0.000107913669064748
"had a bit of","a",0.00012589928057554
"had a dollar for","every",8.99280575539568e-05
"had a dream i","was",0.000107913669064748
"had a dream last","night",0.000107913669064748
"had a good time","and",8.99280575539568e-05
"had a great day","at",0.000143884892086331
"had a great day","with",0.000107913669064748
"had a great time","and",0.000179856115107914
"had a great time","at",0.000413669064748201
"had a great time","in",0.000107913669064748
"had a great time","last",0.000107913669064748
"had a great time","on",8.99280575539568e-05
"had a great time","with",0.000215827338129496
"had a lot of","fun",0.000449640287769784
"had a lot to","do",8.99280575539568e-05
"had a ton of","fun",0.000107913669064748
"had anything to do","with",8.99280575539568e-05
"had in a long","time",0.00012589928057554
"had it not been","for",0.000107913669064748
"had more than a","few",8.99280575539568e-05
"had no choice but","to",8.99280575539568e-05
"had no idea what","i",0.000143884892086331
"had no idea what","to",0.000143884892086331
"had nothing to do","with",0.000287769784172662
"had one of the","best",0.000107913669064748
"had so much fun","at",0.000143884892086331
"had so much fun","with",0.00012589928057554
"had something to do","with",0.000251798561151079
"had such a great","time",0.00012589928057554
"had the chance to","see",8.99280575539568e-05
"had to come up","with",0.000143884892086331
"had to go back","to",8.99280575539568e-05
"had to go to","the",0.00012589928057554
"hahah did you like","our",8.99280575539568e-05
"hand in hand with","the",8.99280575539568e-05
"hands up in the","air",8.99280575539568e-05
"happens to the best","of",8.99280575539568e-05
"happy birthday cody many","years",0.000107913669064748
"happy birthday f0 u","009f",0.000161870503597122
"happy birthday hope you","have",0.000251798561151079
"happy birthday i hope","you",0.000215827338129496
"happy birthday to her","please",0.000161870503597122
"happy birthday to one","of",0.000197841726618705
"happy cinco de mayo","everyone",8.99280575539568e-05
"happy first day of","spring",8.99280575539568e-05
"happy mother's day to","all",0.000647482014388489
"happy mother's day to","my",0.000161870503597122
"happy mother's day to","the",8.99280575539568e-05
"happy mothers day to","all",0.000593525179856115
"happy mothers day to","my",0.000161870503597122
"happy mothers day to","the",0.00012589928057554
"happy mothers day to","you",0.000107913669064748
"happy new year to","all",0.000179856115107914
"happy new year to","everyone",0.00012589928057554
"happy new year to","you",0.000197841726618705
"harass harass harass harass","harass",0.000215827338129496
"hard drive data recovery","services",8.99280575539568e-05
"has a lot to","do",8.99280575539568e-05
"has been a long","time",0.000143884892086331
"has been a lot","of",0.00012589928057554
"has been a while","since",8.99280575539568e-05
"has been going on","for",0.00012589928057554
"has been one of","my",8.99280575539568e-05
"has been one of","the",0.000161870503597122
"has come to a","close",8.99280575539568e-05
"has got to be","a",0.000107913669064748
"has nothing to do","with",0.000899280575539568
"has some of the","best",8.99280575539568e-05
"has something to do","with",0.000161870503597122
"has the potential to","be",8.99280575539568e-05
"has to be one","of",0.000107913669064748
"has to be the","most",8.99280575539568e-05
"has to do with","the",0.000143884892086331
"hate not being able","to",8.99280575539568e-05
"hate to say it","but",8.99280575539568e-05
"have a bit of","a",0.00012589928057554
"have a friend who","is",0.00012589928057554
"have a good one","i",8.99280575539568e-05
"have a great day","and",0.000233812949640288
"have a great day","at",8.99280575539568e-05
"have a great day","everyone",0.00012589928057554
"have a great day","i",0.000197841726618705
"have a great day","you",8.99280575539568e-05
"have a great rest","of",0.00012589928057554
"have a great weekend","everyone",0.000161870503597122
"have a great weekend","i",0.000251798561151079
"have a great weekend","my",8.99280575539568e-05
"have a great weekend","rt",8.99280575539568e-05
"have a long way","to",0.000179856115107914
"have a look at","the",0.000161870503597122
"have a lot of","fun",0.00012589928057554
"have a lot of","time",0.000143884892086331
"have a new server","ready",0.000233812949640288
"have a problem with","it",0.000107913669064748
"have a sense of","humor",8.99280575539568e-05
"have a soft spot","for",8.99280575539568e-05
"have accepted and allowed","myself",0.000197841726618705
"have an amazing day","love",8.99280575539568e-05
"have anything to do","with",0.000215827338129496
"have been a part","of",8.99280575539568e-05
"have come to the","conclusion",0.000143884892086331
"have ever seen in","my",8.99280575539568e-05
"have it all figured","out",0.000107913669064748
"have it any other","way",0.00012589928057554
"have no choice but","to",0.000215827338129496
"have no idea how","much",0.000215827338129496
"have no idea how","to",0.00012589928057554
"have no idea what","i",0.00012589928057554
"have no idea what","it",0.000107913669064748
"have no idea what","the",0.000107913669064748
"have not been able","to",0.000143884892086331
"have not failed i've","just",8.99280575539568e-05
"have nothing to do","with",0.000233812949640288
"have plenty of time","to",0.000107913669064748
"have said it better","myself",0.000107913669064748
"have something to do","with",0.000143884892086331
"have to admit it","was",8.99280575539568e-05
"have to admit that","i",0.000197841726618705
"have to be in","the",8.99280575539568e-05
"have to be willing","to",0.00012589928057554
"have to check it","out",0.000179856115107914
"have to deal with","it",8.99280575539568e-05
"have to deal with","the",8.99280575539568e-05
"have to do to","get",8.99280575539568e-05
"have to find a","way",0.000107913669064748
"have to get back","to",8.99280575539568e-05
"have to get up","at",0.000143884892086331
"have to go back","and",8.99280575539568e-05
"have to go back","to",0.00012589928057554
"have to go through","the",0.000107913669064748
"have to go through","this",0.000107913669064748
"have to go to","the",0.000305755395683453
"have to put up","with",8.99280575539568e-05
"have to say i","m",0.000107913669064748
"have to say i","was",8.99280575539568e-05
"have to say it","was",8.99280575539568e-05
"have to say that","i",0.000197841726618705
"have to say this","is",8.99280575539568e-05
"have to take care","of",8.99280575539568e-05
"have to tell you","that",0.00012589928057554
"have to wait and","see",0.000143884892086331
"have to wait for","the",0.00012589928057554
"have to wait in","line",8.99280575539568e-05
"have to wake up","at",8.99280575539568e-05
"have you been all","my",0.00012589928057554
"have you been to","the",0.000107913669064748
"have you been up","to",8.99280575539568e-05
"have you checked out","our",8.99280575539568e-05
"have you checked out","the",0.000143884892086331
"have you ever been","in",8.99280575539568e-05
"have you ever had","a",0.000161870503597122
"have you ever heard","of",0.00012589928057554
"haven't been able to","get",8.99280575539568e-05
"haven't been on here","in",0.000107913669064748
"haven't been on in","a",8.99280575539568e-05
"haven't been on this","account",8.99280575539568e-05
"haven't had a chance","to",0.00012589928057554
"haven't talked to you","in",0.000179856115107914
"haven't tweeted in a","while",8.99280575539568e-05
"haven t been able","to",0.000161870503597122
"having a bit of","a",8.99280575539568e-05
"having a great time","at",8.99280575539568e-05
