"Input","Predict","Frequency"
"incorporated in item above","and",8.99280575539568e-05
"incorporated in item above","pp",0.000647482014388489
"incorporated in item projected","above",0.000107913669064748
"increase in the number","of",8.99280575539568e-05
"interested in learning more","about",8.99280575539568e-05
"interesting to say the","least",8.99280575539568e-05
"interview you and on","wednesday",0.00012589928057554
"into the hands of","the",8.99280575539568e-05
"into the swing of","things",0.000143884892086331
"ip pptp l2tp sstp","server",0.000161870503597122
"is a awsome account","related",0.000107913669064748
"is a bit of","a",0.000305755395683453
"is a good example","of",0.000107913669064748
"is a good idea","to",0.000107913669064748
"is a good thing","and",8.99280575539568e-05
"is a good thing","but",8.99280575539568e-05
"is a great place","to",0.000197841726618705
"is a great way","to",0.000575539568345324
"is a lot of","work",0.000107913669064748
"is a member of","the",0.000107913669064748
"is a part of","the",8.99280575539568e-05
"is a participant in","the",0.00039568345323741
"is a perfect example","of",0.000107913669064748
"is a waste of","time",0.000107913669064748
"is always going to","be",0.00012589928057554
"is an hot account","related",8.99280575539568e-05
"is an important part","of",0.000143884892086331
"is and is subject","to",0.00039568345323741
"is as good as","mine",8.99280575539568e-05
"is at the end","of",0.000107913669064748
"is becoming more and","more",0.000107913669064748
"is by far one","of",8.99280575539568e-05
"is coming to an","end",0.000179856115107914
"is considered to be","the",8.99280575539568e-05
"is crazy but heres","my",0.000107913669064748
"is definitely one of","the",8.99280575539568e-05
"is f0 u 009f","u",8.99280575539568e-05
"is free and open","to",8.99280575539568e-05
"is going to be","a",0.00147482014388489
"is going to be","amazing",0.000161870503597122
"is going to be","an",0.00012589928057554
"is going to be","awesome",8.99280575539568e-05
"is going to be","fun",8.99280575539568e-05
"is going to be","my",0.000143884892086331
"is going to be","on",0.000197841726618705
"is going to be","one",0.000161870503597122
"is going to be","so",0.00012589928057554
"is going to be","the",0.000431654676258993
"is going to be","very",8.99280575539568e-05
"is going to have","a",8.99280575539568e-05
"is going to have","to",0.000179856115107914
"is going to take","a",8.99280575539568e-05
"is gonna be a","great",8.99280575539568e-05
"is having a great","day",0.000107913669064748
"is important to note","that",8.99280575539568e-05
"is in the eye","of",0.000107913669064748
"is it bad that","i",0.000143884892086331
"is it going to","be",0.000143884892086331
"is it just me","or",0.000809352517985611
"is it me or","does",8.99280575539568e-05
"is it me or","is",0.000143884892086331
"is it so hard","to",0.000161870503597122
"is it weird that","i",0.00012589928057554
"is just around the","corner",0.00026978417266187
"is just one of","the",8.99280575539568e-05
"is no such thing","as",0.00026978417266187
"is not a bad","thing",8.99280575539568e-05
"is not as easy","as",8.99280575539568e-05
"is not enough we","must",0.000107913669064748
"is not going to","be",0.000107913669064748
"is not one of","my",8.99280575539568e-05
"is not the same","as",0.000179856115107914
"is not to say","that",8.99280575539568e-05
"is not worthy of","me",8.99280575539568e-05
"is nothing more than","a",0.00012589928057554
"is nothing you can","do",8.99280575539568e-05
"is on her way","to",8.99280575539568e-05
"is one of my","favorite",0.000809352517985611
"is one of my","favorites",0.000179856115107914
"is one of my","favourite",8.99280575539568e-05
"is one of the","best",0.000683453237410072
"is one of the","biggest",8.99280575539568e-05
"is one of the","few",0.000161870503597122
"is one of the","funniest",8.99280575539568e-05
"is one of the","greatest",0.00012589928057554
"is one of the","main",0.00012589928057554
"is one of the","many",8.99280575539568e-05
"is one of the","more",8.99280575539568e-05
"is one of the","most",0.0010431654676259
"is one of the","reasons",0.000161870503597122
"is one of the","top",0.00012589928057554
"is one of those","things",8.99280575539568e-05
"is provided as is","and",0.00039568345323741
"is right around the","corner",0.000197841726618705
"is shaping up to","be",8.99280575539568e-05
"is so much better","than",8.99280575539568e-05
"is so much to","do",8.99280575539568e-05
"is subject to change","or",0.00039568345323741
"is such a thing","as",0.000107913669064748
"is supposed to be","a",0.000197841726618705
"is that i don","t",0.00012589928057554
"is the author of","the",0.000107913669064748
"is the best place","to",0.000107913669064748
"is the best way","to",0.000215827338129496
"is the end of","the",0.00012589928057554
"is the fact that","i",8.99280575539568e-05
"is the first time","i",0.000215827338129496
"is the first time","that",0.000107913669064748
"is the last day","of",0.00012589928057554
"is the last day","to",0.000107913669064748
"is the most important","thing",0.000143884892086331
"is the name of","the",0.000107913669064748
"is the only thing","that",8.99280575539568e-05
"is the only way","i",8.99280575539568e-05
"is the only way","to",0.000161870503597122
"is the place to","be",0.000107913669064748
"is the root of","all",0.000107913669064748
"is the time to","get",0.000107913669064748
"is the way to","go",0.000215827338129496
"is there a way","to",0.000179856115107914
"is trying to please","everybody",8.99280575539568e-05
"is watching us the","least",8.99280575539568e-05
"is what happens when","you",8.99280575539568e-05
"is what you make","it",0.000107913669064748
"it's a beautiful day","in",0.00012589928057554
"it's a beautiful day","to",0.00012589928057554
"it's a bit of","a",0.000161870503597122
"it's a good thing","i",0.000179856115107914
"it's a good thing","that",0.000107913669064748
"it's a great day","for",8.99280575539568e-05
"it's a great day","to",0.000161870503597122
"it's a great way","to",8.99280575539568e-05
"it's a lot of","fun",0.000107913669064748
"it's as simple as","that",0.000107913669064748
"it's available in your","customer",0.000161870503597122
"it's been a long","time",0.00026978417266187
"it's been a while","since",0.00026978417266187
"it's been way too","long",0.000107913669064748
"it's going to be","a",0.0012410071942446
"it's going to be","an",8.99280575539568e-05
"it's going to be","awesome",0.000107913669064748
"it's gonna be a","great",8.99280575539568e-05
"it's good to be","back",8.99280575539568e-05
"it's just a matter","of",0.000107913669064748
"it's kind of hard","to",8.99280575539568e-05
"it's my birthday today","austin",0.00012589928057554
"it's never too late","to",0.00012589928057554
"it's not a big","deal",0.000107913669064748
"it's not too late","to",8.99280575539568e-05
"it's one of the","best",0.00012589928057554
"it's only a matter","of",8.99280575539568e-05
"it's the end of","the",0.000107913669064748
"it's the last day","of",0.000143884892086331
"it's time for me","to",0.000143884892086331
"it again and again","and",8.99280575539568e-05
"it all comes down","to",0.000143884892086331
"it all depends on","the",8.99280575539568e-05
"it as much as","i",0.000215827338129496
"it at the end","of",8.99280575539568e-05
"it but i don","t",8.99280575539568e-05
"it can be difficult","to",0.000107913669064748
"it comes down to","it",8.99280575539568e-05
"it could have been","a",0.000107913669064748
"it dawned on me","that",0.00012589928057554
"it doesn't get much","better",8.99280575539568e-05
"it doesn't have to","be",0.00012589928057554
"it doesn t have","to",0.000215827338129496
"it doesn t look","like",8.99280575539568e-05
"it doesn t matter","what",8.99280575539568e-05
"it f0 u 009f","u",0.00039568345323741
"it feels good to","be",0.000179856115107914
"it feels so good","to",0.00012589928057554
"it for a long","time",8.99280575539568e-05
"it for the first","time",0.000179856115107914
"it for what it","is",8.99280575539568e-05
"it had nothing to","do",0.000107913669064748
"it has a lot","of",8.99280575539568e-05
"it has been a","long",0.00012589928057554
"it has been a","while",0.000143884892086331
"it has been one","of",8.99280575539568e-05
"it has been suggested","that",8.99280575539568e-05
"it has been too","long",8.99280575539568e-05
"it has nothing to","do",0.000215827338129496
"it has something to","do",0.000107913669064748
"it has to do","with",0.000197841726618705
"it i can't wait","to",8.99280575539568e-05
"it i can do","it",0.000143884892086331
"it if you want","to",0.00012589928057554
"it in the first","place",8.99280575539568e-05
"it is a good","idea",8.99280575539568e-05
"it is a matter","of",0.000107913669064748
"it is almost impossible","to",8.99280575539568e-05
"it is better to","be",0.000107913669064748
"it is going to","be",0.000485611510791367
"it is important to","note",8.99280575539568e-05
"it is more of","a",8.99280575539568e-05
"it is much easier","to",0.000107913669064748
"it is one of","my",0.000161870503597122
"it is one of","the",0.000359712230215827
"it is supposed to","be",8.99280575539568e-05
"it is the last","of",0.000107913669064748
"it is time for","a",8.99280575539568e-05
"it is time for","the",8.99280575539568e-05
"it is very difficult","to",8.99280575539568e-05
"it is what it","is",0.000359712230215827
"it just me or","are",8.99280575539568e-05
"it just me or","does",0.00026978417266187
"it just me or","is",0.000215827338129496
"it let me know","how",8.99280575539568e-05
"it looked like it","was",8.99280575539568e-05
"it looks like it","s",8.99280575539568e-05
"it made me think","about",8.99280575539568e-05
"it makes me want","to",0.000179856115107914
"it means so much","to",8.99280575539568e-05
"it means to be","a",0.00012589928057554
"it occurred to me","that",8.99280575539568e-05
"it out of my","head",8.99280575539568e-05
"it out of the","park",0.000107913669064748
"it over and over","again",0.000161870503597122
"it reminds me of","a",8.99280575539568e-05
"it s a good","thing",0.000107913669064748
"it s all about","the",0.000143884892086331
"it s been a","while",0.00012589928057554
"it s easy to","see",8.99280575539568e-05
"it s going to","be",0.000287769784172662
"it s hard not","to",8.99280575539568e-05
"it s just that","i",8.99280575539568e-05
"it s kind of","like",0.00012589928057554
"it s no big","deal",0.000107913669064748
"it s not like","i",0.000107913669064748
"it s not so","much",0.00012589928057554
"it s not that","i",8.99280575539568e-05
"it s one of","the",0.000107913669064748
"it s time to","get",8.99280575539568e-05
"it s up to","you",8.99280575539568e-05
"it seems to me","that",0.000323741007194245
"it should be noted","that",0.000107913669064748
"it snow let it","snow",8.99280575539568e-05
"it thank you for","the",8.99280575539568e-05
"it thank you so","much",8.99280575539568e-05
"it thanks for the","follow",0.000143884892086331
"it thanks for the","rt",0.000107913669064748
"it took a lot","of",0.000107913669064748
"it took me a","few",0.000107913669064748
"it took me a","long",0.000107913669064748
"it took me a","while",0.00012589928057554
"it took me so","long",8.99280575539568e-05
"it turned out to","be",0.000215827338129496
"it turns out to","be",0.000107913669064748
"it was a beautiful","day",0.000107913669064748
"it was a bit","of",0.000143884892086331
"it was a good","idea",8.99280575539568e-05
"it was a great","show",0.00012589928057554
"it was a great","way",0.000107913669064748
"it was a lot","of",0.00026978417266187
"it was a very","nice",8.99280575539568e-05
"it was an honor","to",0.000107913669064748
"it was going to","be",0.000485611510791367
"it was good seeing","you",8.99280575539568e-05
"it was good to","see",0.000197841726618705
"it was great meeting","you",0.000143884892086331
"it was great seeing","you",0.000143884892086331
"it was great to","meet",0.000341726618705036
"it was great to","see",0.000143884892086331
"it was like to","be",0.000107913669064748
"it was meant to","be",0.000143884892086331
"it was nice to","get",8.99280575539568e-05
"it was nice to","have",0.000143884892086331
"it was nice to","see",0.000107913669064748
"it was one of","my",0.000107913669064748
"it was one of","the",0.000557553956834532
"it was one of","those",0.000341726618705036
"it was only a","matter",0.000143884892086331
"it was really nice","to",0.000107913669064748
"it was so great","to",8.99280575539568e-05
"it was so much","fun",0.000323741007194245
"it was so nice","to",0.000215827338129496
"it was such a","fun",8.99280575539568e-05
"it was such a","great",8.99280575539568e-05
"it was supposed to","be",0.00012589928057554
"it was the first","time",0.000179856115107914
"it was time for","me",8.99280575539568e-05
"it was time to","get",0.000107913669064748
"it was time to","go",0.00012589928057554
"it was too late","to",8.99280575539568e-05
"it wasn t going","to",8.99280575539568e-05
"it will be a","great",0.00012589928057554
"it will be great","to",0.00012589928057554
"it will be hard","to",8.99280575539568e-05
"it will be interesting","to",0.000107913669064748
"it will be nice","to",0.000107913669064748
"it will be worth","it",8.99280575539568e-05
"it will have to","be",8.99280575539568e-05
"it won't be the","same",0.00012589928057554
"it would be a","good",0.000233812949640288
"it would be a","great",0.000143884892086331
"it would be a","shame",8.99280575539568e-05
"it would be better","to",8.99280575539568e-05
"it would be fun","to",0.000413669064748201
"it would be good","to",0.00012589928057554
"it would be great","to",0.000179856115107914
"it would be hard","to",0.000143884892086331
"it would be like","to",0.000179856115107914
"it would be nice","to",0.000161870503597122
"it would have been","a",0.000179856115107914
"it would have to","be",0.000143884892086331
"it would mean a","lot",0.00012589928057554
"it would mean so","much",0.000197841726618705
"it would mean the","world",0.000215827338129496
"item above and in","item",8.99280575539568e-05
"item above pp see","item",0.000107913669064748
"its been a long","day",8.99280575539568e-05
"its going to be","a",0.000143884892086331
"its time for me","to",0.000107913669064748
"joe dan wilson and","kyle",8.99280575539568e-05
"john smith s grand","national",0.000287769784172662
"journey limited time offer","contact",8.99280575539568e-05
"judge a book by","its",0.000179856115107914
"jumped at the chance","to",0.000107913669064748
"just a few more","days",0.000107913669064748
"just a few of","my",0.000107913669064748
"just a few of","the",0.000179856115107914
"just a few weeks","ago",0.00012589928057554
"just a few years","ago",8.99280575539568e-05
"just a matter of","time",0.000107913669064748
"just as much as","the",8.99280575539568e-05
"just don t know","what",0.000107913669064748
"just don t want","to",8.99280575539568e-05
"just finished a mi","run",0.000431654676258993
"just for the sake","of",0.00012589928057554
"just found ways that","won't",8.99280575539568e-05
"just going to have","to",0.000107913669064748
"just got back from","the",0.000233812949640288
"just got home from","a",0.000107913669064748
"just got off the","phone",0.000107913669064748
"just have to take","a",8.99280575539568e-05
"just in time for","the",0.000323741007194245
"just let me know","when",0.00012589928057554
"just me or does","it",0.00012589928057554
"just met you and","this",0.000107913669064748
"just saw the trailer","for",0.00012589928057554
"just sent you an","email",0.000161870503597122
"just shut the fuck","up",8.99280575539568e-05
"just so happens to","be",8.99280575539568e-05
"just somebody that i","used",0.000143884892086331
"just the right amount","of",0.000107913669064748
"just to let you","know",0.000107913669064748
"just to name a","few",0.000143884892086331
"just want you to","know",0.00012589928057554
"just wanted to let","you",0.000215827338129496
"just wanted to say","i",8.99280575539568e-05
"just wanted to say","thanks",0.000107913669064748
"just wanted to tell","you",8.99280575539568e-05
"just woke up from","a",0.000179856115107914
"k u 1e5b u","u",0.000449640287769784
"kanjoya's emotional tool can","assist",0.000107913669064748
"keep an eye on","the",0.000107913669064748
"keep an eye out","for",0.00026978417266187
"keep freaking out keep","freaking",0.000161870503597122
"keep up the good","work",0.000845323741007194
"keep up the great","work",0.000503597122302158
"keep your head up","and",8.99280575539568e-05
"keeps getting better and","better",8.99280575539568e-05
"key to failure is","trying",0.000107913669064748
"key to success but","the",0.000107913669064748
"kill you makes you","stronger",8.99280575539568e-05
"kimberly and sasha can","they",0.000161870503597122
"kind of donuts do","the",0.000143884892086331
"kisses i'm proud of","be",8.99280575539568e-05
"knew i was going","to",0.00012589928057554
"knew that i had","to",0.00012589928057554
"knew that i wanted","to",8.99280575539568e-05
"knew there was a","reason",8.99280575539568e-05
"know a lot of","you",8.99280575539568e-05
"know about you but","i",0.000323741007194245
"know for a fact","that",0.000107913669064748
"know how i feel","about",0.000107913669064748
"know how it turns","out",8.99280575539568e-05
"know how much i","love",0.000161870503597122
"know how to do","this",8.99280575539568e-05
"know how to use","it",0.000107913669064748
"know i know i","know",8.99280575539568e-05
"know if i can","help",0.000161870503597122
"know if there is","anything",0.000107913669064748
"know if we can","help",8.99280575539568e-05
"know if you have","any",0.000233812949640288
"know if you need","a",0.00012589928057554
"know if you need","anything",0.000107913669064748
"know if you want","to",0.000107913669064748
"know it's going to","be",8.99280575539568e-05
"know that i am","not",8.99280575539568e-05
"know that i know","that",8.99280575539568e-05
"know the key to","success",0.00012589928057554
"know what i'd do","without",8.99280575539568e-05
"know what i'm talking","about",8.99280575539568e-05
"know what i need","to",8.99280575539568e-05
"know what i was","thinking",8.99280575539568e-05
"know what it's like","to",8.99280575539568e-05
"know what time it","is",8.99280575539568e-05
"know what to do","i",0.000107913669064748
"know what to do","with",0.000413669064748201
"know what was going","on",0.000215827338129496
"know what you mean","i",0.000107913669064748
"know what you think","of",8.99280575539568e-05
"know where you are","going",8.99280575539568e-05
"know who you are","i",8.99280575539568e-05
"know you are going","to",8.99280575539568e-05
"know you better who","knows",0.000107913669064748
"knows maybe we can","work",8.99280575539568e-05
"last night i had","a",0.00012589928057554
"last night i went","to",0.000107913669064748
"last night it was","so",8.99280575539568e-05
"last thing i want","to",8.99280575539568e-05
"last time i was","in",0.000107913669064748
"last year and a","half",8.99280575539568e-05
"law loyola university of","chicago",0.000161870503597122
"law tip of the","day",0.000197841726618705
"least we can do","is",0.00012589928057554
"leave a comment on","this",0.000179856115107914
"leave me a comment","and",0.00012589928057554
"let it snow let","it",8.99280575539568e-05
"let me know how","it",0.000215827338129496
"let me know how","that",8.99280575539568e-05
"let me know how","you",0.000161870503597122
"let me know if","i",0.000287769784172662
"let me know if","you",0.00116906474820144
"let me know if","you're",0.00012589928057554
"let me know in","the",8.99280575539568e-05
"let me know what","you",0.000773381294964029
"let me know when","you",0.000431654676258993
"let me know when","you're",0.00012589928057554
"let me tell you","a",8.99280575539568e-05
"let me tell you","about",8.99280575539568e-05
"let me tell you","it",8.99280575539568e-05
"let s just say","that",0.000107913669064748
"let us know how","it",0.000107913669064748
"let us know how","we",0.000107913669064748
"let us know if","there",0.00012589928057554
"let us know if","we",0.000107913669064748
"let us know if","you",0.000719424460431655
"let us know what","you",0.00039568345323741
"let you know that","i",8.99280575539568e-05
"let you know what","i",8.99280575539568e-05
"level mp cost damage","attacks",0.00012589928057554
"level mp cost duration","seconds",0.000215827338129496
"level reduces the damage","received",8.99280575539568e-05
"life and the lives","of",8.99280575539568e-05
"life f0 u 009f","u",0.000143884892086331
"life i wish you","well",0.000107913669064748
"life is too short","to",0.000179856115107914
"life is what you","make",8.99280575539568e-05
"light at the end","of",0.000251798561151079
"light up my world","like",0.000179856115107914
"like a great way","to",8.99280575539568e-05
"like a kid in","a",8.99280575539568e-05
"like a ton of","bricks",8.99280575539568e-05
"like it's going to","be",0.000107913669064748
"like our surprise this","boy",8.99280575539568e-05
"like the end of","the",8.99280575539568e-05
"like the perfect time","to",8.99280575539568e-05
"like the rest of","us",0.00012589928057554
"like this is going","to",8.99280575539568e-05
"like to learn more","about",8.99280575539568e-05
"like to share how","kanjoya's",8.99280575539568e-05
"like to take a","moment",8.99280575539568e-05
"like to thank you","for",0.000107913669064748
"linking to amazon.com amazon.ca","amazon.co.uk",0.00039568345323741
"list goes on and","on",8.99280575539568e-05
"list of things to","do",8.99280575539568e-05
"listen to the music","and",8.99280575539568e-05
"little in the way","of",8.99280575539568e-05
"live in a society","where",0.000107913669064748
"live in a world","where",0.00012589928057554
"live life to the","fullest",0.000179856115107914
"llc and amazon eu","associates",0.00039568345323741
"llc and or amazon","eu",0.00039568345323741
"lol f0 u 009f","u",0.000161870503597122
"lol thanks for the","follow",0.000179856115107914
"lol thanks for the","rt",8.99280575539568e-05
"long as i can","remember",8.99280575539568e-05
"look at some of","the",8.99280575539568e-05
"look forward to hearing","from",8.99280575539568e-05
"look forward to seeing","you",0.00026978417266187
"look forward to seeing","your",0.000107913669064748
"look forward to tweeting","with",8.99280575539568e-05
"look forward to your","tweets",0.000215827338129496
"look in the mirror","and",0.00012589928057554
"look look look look","look",0.000179856115107914
"looked at me and","said",0.000143884892086331
"looking for a place","to",0.000107913669064748
"looking for a way","to",0.00012589928057554
"looking forward to a","great",0.000197841726618705
"looking forward to getting","to",0.000197841726618705
"looking forward to hanging","out",8.99280575539568e-05
"looking forward to hearing","from",8.99280575539568e-05
"looking forward to it","i",8.99280575539568e-05
"looking forward to meeting","you",0.000143884892086331
"looking forward to reading","your",0.00012589928057554
"looking forward to seeing","the",0.000161870503597122
"looking forward to seeing","what",8.99280575539568e-05
"looking forward to seeing","you",0.000485611510791367
"looking forward to seeing","your",0.000107913669064748
"looking forward to the","next",0.000215827338129496
"looking forward to the","weekend",0.000197841726618705
"looking forward to working","with",8.99280575539568e-05
"looking forward to your","tweets",0.000305755395683453
"looks like it's going","to",8.99280575539568e-05
"lots of work to","do",0.00012589928057554
"love f0 u 009f","u",0.00012589928057554
"love me for who","i",8.99280575539568e-05
"love song i'll be","sick",0.00012589928057554
"love this time of","year",0.00012589928057554
"love to be able","to",0.000143884892086331
"love to have you","on",8.99280575539568e-05
"love to hear about","your",8.99280575539568e-05
"love to hear from","you",0.000143884892086331
"love to see what","you",0.000107913669064748
"love to talk to","you",0.000197841726618705
"love you f0 u","009f",0.000143884892086331
"love you i love","you",0.000593525179856115
"love you so much","and",0.000197841726618705
"love you so much","i'm",8.99280575539568e-05
"love you so much","my",8.99280575539568e-05
"love you so much","you",8.99280575539568e-05
"love you so so","so",0.000107913669064748
"love you su much","never",8.99280575539568e-05
"love you with all","my",0.00012589928057554
"loved every minute of","it",0.00012589928057554
"loving every minute of","it",0.00012589928057554
"loyola university of chicago","chicago",0.000179856115107914
"m not quite sure","what",8.99280575539568e-05
"mad dogs and englishmen","go",0.000107913669064748
"made me laugh so","hard",0.000107913669064748
"made me think of","you",8.99280575539568e-05
"made our way back","to",8.99280575539568e-05
"made this account to","support",8.99280575539568e-05
"make a lot of","sense",8.99280575539568e-05
"make it a great","day",0.000161870503597122
"make my dream come","true",0.00012589928057554
"make sure to check","out",0.00012589928057554
"make sure you check","out",0.000161870503597122
"make sure you have","a",0.000179856115107914
"make the best of","it",0.000161870503597122
"make the best of","the",8.99280575539568e-05
"make the most of","it",0.000143884892086331
"make the world a","better",0.00012589928057554
"make you fall in","love",0.000107913669064748
"makes a lot of","sense",8.99280575539568e-05
"makes me feel like","a",8.99280575539568e-05
"makes me think of","the",0.000143884892086331
"makes me want to","do",8.99280575539568e-05
"makes me want to","go",0.000107913669064748
"makes no sense to","me",0.000107913669064748
"many times as you","like",8.99280575539568e-05
"many years of life","i",0.000107913669064748
"matt hunter matt hunter","matt",0.00012589928057554
"matter and those who","matter",8.99280575539568e-05
"matter how hard you","try",0.000161870503597122
"matter how many times","i",0.00012589928057554
"max the body at","hollywood",0.000143884892086331
